탁주(고도),씨(C) 옐로막걸리,12%,"쌀, 물, 누룩, 당근, 레몬그라스","당도가 높지 않고, 드라이하지 않다.","동남아요리, 회, 해산물 냉채 또는 닭고기, 오리고기 등의 가금류와 어울린다."
탁주(고도),씨(C) 막걸리 시그니처 큐베,12%,"쌀, 물, 누룩, 노간주나무열매, 건포도","C막걸리의 시그니처 제품으로 항아리에 발효한 범벅 밑술을 사용하며, 노간주나무 열매의 유쾌한 산미가 특징이다. 고도수이지만 걸쭉하지 않은 깔끔한 질감으로 와인의 대체재로 마실 수 있는 막걸리이다.","치즈가 들어간 전식, 사천요리, 중식/한식의 퓨전요리와 어울린다."
탁주(고도),지평 이랑이랑,5%,"정제수, 쌀, 자일리톨, 국, 효모, 레몬농축액, 허브류","""지평 이랑이랑""은 일반적인 막걸리와 차별화된 ""스파클링 막걸리""로, 마셨을 때 시원한 탄산을 느낄 수 있어 더운 여름철에 즐기기 좋다. 젊은 층을 타깃으로 기획해 묵직하고 텁텁하기보다 가볍고 깔끔한 맛이 특징이다.","파스타, 피자, 치킨 등 파티 요리"
탁주(고도),구름을 벗삼아,12%,"백미(국내산: 지역햅쌀 100%), 우리밀 전통누룩",문경주조의 구름을 벗삼아는 유기농 찹쌀과 전통누룩을 사용한 단 맛이 살짝 가미된 깔끔한 스타일의 탁주이다. 일반 쌀 막걸리와 달리 단 맛이 적고 도수가 낮아 반주로도 가볍게 즐기기 좋은 술이다.,"해물파전, 김치전 등 전 요리와 잘 어울린다."
탁주(고도),도구막걸리,6%,"정제수, 밀가루, 효모, 조제종국, 정제효소제, 젖산, 아스파탐, 아세설팜칼륨","포항에서 가장 오래된 밀 막걸리로, 부드럽고 구수한 맛이 특징입니다. 잔당감이 거의 없는 뒷맛으로, 바디감이 묵직함에도 질리지 않고 마실 수 있는 음용성이 매우 뛰어납니다.","제육볶음, 골뱅이무침"
탁주(고도),세오녀탁주,6%,"정제수, 쌀(국내산, 포항쌀), 누룩, 효모, 조제종국, 정제효소제, 젖산","탄산과 강한 단맛을 가진 일반 막걸리와는 달리, 무감미로 만들어져 어떤 해산물 안주와도 잘 어울리는 막걸리이다. 걸쭉한 느낌보다는 담담하게 입안으로 넘어가는 질감을 천천히 음미해볼 수 있는 쌀 와인에 가깝다.",회를 비롯한 해산물 음식과 잘 어울린다.
탁주(고도),동해동동주,6%,쌀100%(포항쌀),쌀이 동동 뜬 옛 동동주의 모습을 연상시켜 아직까지 많은 애주가들에게 사랑을 받고 있는 술이다. 청량감과 단맛이 적절하게 어우러져 부드러운 맛과 시원함을 동시에 느낄 수 있다.,"돼지고기수육, 두부김치, 해물파전과 잘 어우러진다."
탁주(고도),연오랑탁주,12%,"정제수, 쌀(국내산, 포항쌀), 누룩, 효모, 조제종국, 정제효소제, 젖산",무감미 막걸리인 연오랑 탁주는 드라이하고 깔끔한 맛을 가지고 있다. 12도의 막걸리로 탄탄한 바디감과 구수한 맛이 일품인 술이다.,"구운고기, 양념고기와 잘 어울린다."
탁주(고도),영탁막걸리,6%,"정제수, 백미(국내산), 입국(쌀, 밀), 물엿, 올리고당, 누룩(밀), 효모, 아스파탐, 아세설팔칼륨",차고 달아 술 빚기에 으뜸으로 꼽는 예천의 물로 빚은 막걸리이다. 특유의 묵직한 바디감이 느껴지는 일반 막걸리와 달리 부드러우면서도 깔끔한 목넘김이 일품이며 가볍게 안주 없이 즐기기에도 적당한 술이다.,"전, 보쌈과 같은 기름진 음식에 잘 어울린다."
탁주(고도),별산막걸리,6.5%,"정제수, 쌀(국내산), 입국, 효모, 당류가공품",별산막걸리는 경기도 양주의 단단한 쌀을 사용하고 어느 누구도 시도하지 않은 특별한 발효균주를 이용하여 만든 프리미엄 막걸리다. 맛과 품질에서 우수함을 인정 받은 결과 대한민국주류대상  3회 수상 경력의 귀한 막걸리.다,"갈비찜, 전류 등 기름진 음식과 매칭이 좋으며, 다양한 치즈와 매칭해 즐겨봐도 좋다."
탁주(고도),풍정사계 추(秋),12%,풍정사계 추(秋),추는 설기로 밑술한 법술을 발효 후 저온 숙성한 탁주로 옹기에서 100일 저온숙성해 만든 술로 완전발효되어 숙취가 없고 뒤끝이 깨끗하다. 특유의 꽃향이 있으며 쓴맛과 단맛 어느 하나에 치우치지 않아 조화롭고 진한 아이보리색을 띠며 막 익은 과실의 신선한 향이 있고 새콤달콤한 맛이 느껴진다.,완자전과 잘 어울린다.
탁주(고도),지리산 허브잎술 쌀 막걸리,6%,"쌀(국내산), 입국, 정제수, 효모, 곡자, 국내산허브(로즈마리, 라벤다잎줄기추출액, 울금) 등","&amp;quot;지리산 허브잎 술&amp;quot;은 지리산에서 자란 로즈마리, 라벤다를 첨가해 빚은 막걸리다. 한 모금 맛보면 은은하게 허브향이 느껴진다. 익은 곡물향이 강하게 올라오고 달콤함 향이 묻어 나온다. 단맛이 적고 약간의 산미가 입안 전체를 가볍게 만들어 준다. 전체적으로 달지 않아 음식과의 궁합을 잘 맞출 수 있는 술이다.","홍어회 무침, 골뱅이 무침"
탁주(고도),야관문 쌀 막걸리,6%,"팽화미, 입국, 효모, 곡자(밀), 정제수, 야관문잎 줄기 추출액 등",야관문 막걸리는 비수리라 불리는 토종허브 야관문을 넣고 빚었다. 밤의 빗장을 여는 문이라는 뜻을 가진 야관문은 술로 빚어 섭취하면 더욱 효능이 좋다고 알려져 있다. 연한 아이보리 색을 갖고 있으며 곡물을 압력으로 튀겼을 때 나는 고소한 향이 강한 것이 특징이다. 전체적인 맛의 조화를 잘 갖추고 있으며 단맛보다는 산미가 도드라진다.,채소 샐러드와 어을린다.
탁주(고도),동래아들,6%,"정제수, 찹쌀, 맵쌀, 밀누룩",일체의 첨가물 없이 쌀과 누룩으로만 빚은 막걸리이다. 최상의 품질을 유지하기 위해 하루 500병 한정 생산하며 긴 발효시간과 숙성기간을 거쳐 탄생됐다. 마시면 마실수록 입안에 퍼지는 상큼함과 달콤함이 매력적인 탁주이다.,고소한 파전과 같은 전류와 페어링하기 좋다.
탁주(고도),호모루덴스,12%,"쌀, 누룩, 정제수",호모루덴스는 삼양주기법으로 멥쌀을 원료로 빚은 술인만큼 드라이한 풍미가 강한 술이다. 단맛이 적어 음식과 곁들여 마시기에 좋으며 100일 동안 저온 숙성하고 일체의 인공감미료나 첨가물이 들어가지 않은 자연 그대로의 술이다. 맵쌀로 빚은 술로  탄산은 없고 고운 곡물맛 바탕의 깔끔한 감칠맛이 느껴진다.,입 안의 풍미가 강하고 술을 마시고 난 후에도 긴 여운이 남아 돼지 목살 숯불 구이와 잘 어울린다.
탁주(고도),해창 막걸리 9도,9%,"햅쌀, 찹쌀, 물, 누룩","땅끝 해남의 청정 자연 발효환경에서 생산된 프리미엄 무감미료 생막걸리이다. 국내산 100% 멥쌀과 찹쌀에서 나오는 인위적이지 않은 단맛이 매력적이다. 물이 적게 들어가 원재료의 맛이 살아있으며, 은은한 단향과 과실향이 난다. 찹쌀의 감칠맛과 멥쌀의 센맛이 자연스럽게 어우러져 묵직하고 바디감이 있다.",전복구이와 잘 어울린다.
탁주(고도),우렁이쌀 손막걸리 DRY,7.5%,"정제수, 찹쌀(국내산), 쌀(국내산), 효모, 종국",우렁이 찹쌀을 발효 소재로 골라 화학첨가제가 들어가지 않은 순수한 술이다. 장기 저온숙성하여 부드러운 목넘김과 감칠맛을 가지고 있다. 달달한 맛이 느껴진다.,양념이 강하지 않은 부드럽고 담백한 생선회 및 한식 요리와 잘 어울린다.
탁주(고도),희양산 막걸리 15도,15%,"정제수, 쌀(국내산), 누룩(국내산), 효모",옅은 단맛과 약간의 신맛이 느껴지는 막걸리다. 담백하고 깔끔한 맛을 가지고 있으며 15도의 높은 도수를 가지고 있음에도 부드러운 목넘김이 일품인 술이다.,매콤한 볶음류의 음식와 잘 어울린다.
탁주(고도),희양산 막걸리 9도,9%,"정제수, 쌀(국내산), 누룩(국내산), 효모",친환경 재료만을 사용한 알코올 감과 멥쌀만으로 술을 빚음에도 불구하고 옅은 단맛과 약간의 신맛이 조화로워 깔끔하고 담백한 맛이 일품이며 부드러운 목넘김을 가지고 있다.,"생굴, 두부, 육류 안주를 추천한다."
탁주(고도),술공방 9.0 막걸리,9%,"정제수, 쌀(국내산), 국(쌀, 국내산), 누룩(밀)","수제 누룩과 청양 햅쌀의 진하고 풍부한 맛을 느낄 수 있으며 살짝만 흔들어도 될 정도로 걸쭉한 느낌을 가지고 있다. 발효의 조화만으로 바나나 향 첨가 없이 바나나 맛이 난다. 또한, 진하고 풍부한 바디감과 강렬한 탄산, 향긋한 산미를 가진 수제 막걸리다.","국물 떡볶이, 매운탕, 고기전과 잘 어울린다."
탁주(고도),나루 생 막걸리 11.5도,11.5%,"정제수, 쌀(국내산), 국, 효모(밀함유)","높은 쌀 함유량으로 원재료인 쌀 본연의 단맛을 살려 깔끔한 목넘김을 가지고 있다. 묵직한 텍스처, 청사과와 배의 향이 나며 시트러스 계열의 여운이 깊게 남는다. 무더운 여름, 얼음을 곁들여 온더락으로 마시기 좋은 막걸리다.",매콤한 쭈꾸미 볶음류와 잘 어울린다.
탁주(고도),나루 생 막걸리 6도,6%,"정제수, 쌀(국내산), 국, 효모(밀함유)",원재료인 쌀 본연의 맛을 살려 깔금하게 넘어가는 목넘김이 좋은 인공 감미료 및 천연감미료 무첨가 막걸리다. 시간의 지남에 따라 주차별로 맛이 달라져 취향에 맞게 즐기기 좋다.,매콤한 쭈꾸미 볶음류와 잘 어울린다.
탁주(고도),호두땅콩막걸리,6%,"물, 쌀(국내산), 고과당, 국(밀), 땅콩(국내산)","쌀로 만든 막걸리에 고소한 땅콩이 그대로 들어 있는 듯한 느낌이다. 땅콩에 호두 향을 더해 담백하고, 풍미가 가득하며 부드러운 맛을 느낄 수 있다.",불닭갈비와 잘 어울린다.
탁주(고도),아띠,6%,쌀(국내산),포천쌀의 자연발효로 생기는 천연 스파클링이 주는 가볍고 깔끔한 목넘김과 강한 청량감을 느낄 수 있다.,"피자, 치킨, 파스타 등 다양한 대표 파티 메뉴 및 생선회 요리와 페이렁하기 좋다."
탁주(고도),복순도가 탁주,10%,"정제수, 쌀(국산), 곡자(밀), 밀함유",옛 항아리에서 100일 이상 저온숙성으로 직접 빚은 전통 누룩 사용해 더욱 진하고 부드러운 바디감이 느껴진다. 언양 쌀의 구수한 곡물맛과 잘 발효된 막걸리에서 느껴지는 감칠맛이 특징이다.,고추장찌개가 떠오르는 바디감을 가졌다. 혹은 항정살 수육 무침과 함께 해도 좋다.
탁주(고도),복순도가 손막걸리,6.5%,"정제수, 쌀(국산), 곡자(밀), 물엿, 설탕, 아스파탐(감미료,페닐알라닌함유)","손으로 직접 빚은 순수 생막걸리, 복순도가 손막걸리는 전통 방식으로 빚은 가양주 형식의 전통주로써, 비옥한 토양에서 자란 국내산 쌀만을 사용, 옛 항아리에 담아 정성스레 빚은 천연 탄산 막걸리이다. 특히, 복순도가 손막걸리는 샴페인이 연상될 만큼 탄산이 매우 풍부하다.","파전, 치킨, 보쌈, 족발, 해산물 등 다채로운 페어링이 가능하다."
탁주(고도),장수 생막걸리,6%,"백미(국내산), 말토올리고당, 홍삼분말","국내산 백미를 사용해 장기저온숙성 방식으로 만들어져 영양이 풍부하고 자연발효에 의한 탄산과 어울려 감칠맛과 청량감이 일품입니다. 또한, 트림과 숙취도 거의 없어 오랜 시간 동안 사랑을 받고 있습니다.",일반적인 서울장수막걸리에서 느껴지는 익숙한 단맛과 과일향과 함께 상쾌한 탄산기운을 느낄 수 있다. 전체적으로 순하고 부드러운 맛이다. 목으로 넘길 때 탄산의 느낌이 강하여 시원하고 긴 여운이 남는다. 막걸리 안주로 생각할 수 있는 음식에는 어느 것이나 궁합이 맞다.
탁주(고도),대대포 막걸리,6%,"쌀, 벌꿀, 정제수, 정제효소, 스테비올배당체, 젖산, 종국, 효모","대대포 막걸리는 담양에서 생산된 100% 유기농 쌀을 원료로 사용하여 쌀의 아밀로스를 최적화시킨 향미가 살아있는 생막걸리다.각종 미네랄, 비타민이 풍부한 지리산 벌꿀을 첨가해 씁쓸하고 텁텁한 감이 있으며, 맛이 깔끔하고 달달해 애주가들에게 청량감과 감칠맛이 뛰어나다고 평가받고 있다.","시원하고 아삭한 오이소박이, 오이 달걀 볶음, 소고기 오이 볶음과 잘 어울린다."
탁주(고도),배꽃담은연,10%,"쌀 26.1%, 효모 0.07%, 젖산 0.05%, 정제수 72.31%",쌀누룩 이화곡으로 빚어 양반댁 규수들이 즐기던 이화주에 물의 함량 을 늘리고 연잎에 싸서 빚은 새로운 방식의 탁주다. 연잎의 알싸한 맛과 이화곡의 풍부한 풍미가 조화를 이룬 걸쭉한 막걸리로 새콤한 맛으로 식전주에 잘 어울린다.,"식전에 입가심을 하기에 좋고, 한식과 잘 어울리는 막걸리 탁주다."
탁주(고도),여인,12%,"구멍떡, 누룩, 찹쌀","밑술을 멤쌀 구멍떡으로 빚은 후, 찹쌀 고두밥으로 덧술하여 100일간 발효·숙성시킨 탁주입니다. 부원료나 첨가물을 넣지 않고 쌀과 누룩 물 만으로 빚은 술로 구멍떡 특유의 감칠맛과 향이 납니다.",특유의 감칠맛으로 안주류 없이도 마시기 좋으나 전 종류 혹은 떡과도 잘 어울립니다.
탁주(고도),동정춘막걸리,6%,"국내산 쌀, 누룩, 정제수","평생 한 번은 마셔봐야 할 술로 일컬어졌던 3대 명주 가운데 하나인 ‘동정춘’의 맛은 벌꿀처럼 부드럽게 입에 달라붙는 무게감이 있고, 향은 과일향이 섞인 듯 향긋합니다. 멤쌀 구멍떡으로 밑술을 빚은 후 찹쌀 고두밥으로 덧술을 한 이양주로, 물의 사용량을 최소화하여 단맛을극대화한 술입니다.",무화과 등의 달달한 디저트류 과일과 궁합이 좋습니다.
탁주(고도),우도땅콩전통주,6%,"쌀, 우도땅콩","우도는 섬이지만 땅이 비옥하여 어업보다는 농업이 발달한 섬이다. 여기에서 재배하는 땅콩은 작고 고소하기로 소문 나 있는데 이 땅콩을 원료로 고소한 맛과 향과 맛을 그대로 느껴볼 수 있는 술이 우도땅콩전통주다. 방앗간에서 깨소금을 볶았을 때 나는 고소한 향기를 가지고 있으며, 산미가 적고 단맛이 강하지만 목넘김은 매우 깔끔하다. 입 안에 기름진 맛이 특징이다.","우도는 섬이지만 땅이 비옥하여 어업보다는 농업이 발달한 섬이다. 여기에서 재배하는 땅콩은 작고 고소하기로 소문 나 있는데 이 땅콩을 원료로 고소한 맛과 향과 맛을 그대로 느껴볼 수 있는 술이 우도땅콩전통주다. 방앗간에서 깨소금을 볶았을 때 나는 고소한 향기를 가지고 있으며, 산미가 적고 단맛이 강하지만 목넘김은 매우 깔끔하다. 입 안에 기름진 맛이 특징이다."
탁주(고도),걍즐겨,8%,"멥쌀,찹쌀,누룩,프렌치세종,석류,히비스커스","발효시 석류즙과 히비스커스를 더해 술에 부족한 산미, 과실향을 보충했으며 베리향이 강조된 탁주이다.","발효시 석류즙과 히비스커스를 더해 술에 부족한 산미, 과실향을 보충했으며 베리향이 강조된 탁주이다."
탁주(고도),유자향주,6%,"쌀(국내산), 유자(고흥산), 아스파탐","청정영농조합의 ‘유자향주’는 전국 유자 생산량의 35% 이상을 차지하고 있는 고흥군의 대표 특산주. 낙지, 굴, 매생이 등 고흥 대표음식인 9미 중 8미에 속한다. 유자청을 3년간 발효시켜 감초와 당귀 등 5종의 한약재를 넣고 20여 일간 숙성해 달콤한 맛이 특징이다. 젊은 여성층 에게 큰 인기를 얻고 있다.",회나 파전 등 대중적인 안주와 잘 어울린다.
탁주(고도),술헤는밤,8%,"쌀(국내산), 누룩(국내산)",술헤는밤은 이양주법으로 빚은 생탁주로 윤동주 시인의 별 헤는 밤처럼 추억과 사랑을 담아낸 제품이다. 첨가물 없이 강원도의 맑은 물과 자연이 키운 쌀로 빚었다. 탄산과 단맛이 강하지 않고 무겁지 않은 바디감으로 목 넘김이 부드러우며 깔끔한 맛과 향이 특징이다.,"녹두전, 파전, 매콤한 회무침, 샐러드와 어울린다."
탁주(고도),심술6 막걸리,6%,"쌀(국내산), 국(입국), 건조효모, 아세설팜칼륨, 아스파탐",포천쌀로 빚은 생막걸리로 크리미한 목 넘김과 은은한 과일향이 매력적인 막걸리다. 적당한 탄산과 은은한 단맛이 잘 어우러진다. 500ml 저용량으로 부담없이 즐길 수 있다.,
탁주(고도),메로니아,4%,"국내산 쌀, 물엿, 합성착향료(메론향), 효모, 국, 혼합제제, 아스파탐, 젖산, 합성 향료(밀크향), 효소처리스테비아, 멜론농축액","메로니아는 막걸리에 멜론특유의 달콤함을 담아 멜론 맛 아이스크림이 그대로 녹아 들어 있는 듯한 탁주이다. 일반적인 과일 막걸리는 살균을 통해 유통기한을 늘리지만, 메로니아는 독특하게 살균을 하지 않은 생 탁주로 생 막걸리 특유의 부드러움과 멜론의 향과 맛이 달콤하게 느껴져 평소 술을 좋아하지 않는 사람도 거리낌없이 즐길 수 있는 술이다.",메론향이 첨가되어 기타주류로 분류되어 있으며 과일맛 막걸리에 맞게 매우 달콤하고 산미가 적으며 탄산에 의한 청량미가 강하다. 마치 메론으로 만든 스파클링 와인을 마시는 듯하다. 식사를 다 한 후에 디저트 술로 좋다.
탁주(고도),만남의장소 (단종),12%,"멥쌀, 밀누룩, 꿀, 건포도, 레몬, 생강, 후추, 효모","‘만남의 장소’는 화학 첨가물 없이 철원의 오대미, 생강, 후추, 꿀, 전통누룩과 효모로 빚은 쌀술이다. 후추에서 피어난 로즈메리 향과 생강의 향을 시작으로 붉은 과실의 단맛과 쌀이 가진 은은한 묵직함의 어우러짐이 특징이다.",기름진 생선회나 강렬한 한국요리들과 어울린다.
탁주(고도),광양 생 막걸리 골드,5%,"정제수, 쌀(국산100%), 입국(국산), 곡자(국산누룩), 아스파탐(감미료, 페닐알라닌 함유), 정제효소, 효모, 젖산, 액화효소","한국식품연구원에서 개발된 국산효모로 만든 막걸리로 햅쌀, 토종 앉은뱅이 밀누룩 등 국내산 좋은 재료를 100% 사용하여 목 넘김이 부드럽고 깔끔한 맛이 살아있는 프리미엄 쌀 막걸리다.","깔끔하고 청량감 높은 광양생막걸리 골드는 치킨, 피자, 치즈 등과 어울린다."
탁주(고도),광양 생 막걸리,5%,"정제수, 쌀(국산100%), 입국(국산), 곡자(국산누룩), 아스파탐(감미료, 페닐알라닌 함유), 정제효소, 효모, 젖산, 액화효소",국산 햅쌀을 사용한 목 넘김이 부드럽고 깔끔한 맛이 살아있는 막걸리이다. 가장 대중적인 맛으로 빨간 뚜겅 광양막걸리 이미지로 고객들의 꾸준한 사랑을 받았다.,"맛이 깊고 목넘김이 부드러운 광양생막걸리는 전, 두부김치, 골뱅이 소면무침 등 우리나라의 음식과 어울린다."
탁주(고도),톡쏘는 옥수수동동,6%,"쌀, 정제수, 입국, 옥수수 농축액, 옥수수 추출물 등","톡쏘는 옥수수동동은 2016년 출시된 ""톡쏘는 알밤동동""과 2018년 출시된 ""톡쏘는 고구마동동""의 확장 제품이다. 세계 3대 작물 중 하나인 옥수수를 넣어 달콤하고 부드러운 옥수수 수프를 연상시키는 전통주로, 청정지역 가평의 지하 250ｍ 천연암반수를 원료로 사용하며 알코올 도수는 6도다.","음료수처럼 마실 수 있고, 한식과 두루 잘 어울린다."
탁주(고도),톡쏘는 고구마동동,6%,"쌀, 정제수, 입국, 고구마 농축액, 고구마 추출물 등","톡쏘는 고구마동동은 기존 출시된 ""톡쏘는 알밤동동""의 확장 제품으로, 막걸리 고유의 맛과 부드러운 자색고구마의 맛과 향을 즐길 수 있는 제품이다. 막걸리에 그대로 담아 특유의 고소한 맛으로 목 넘김이 부드럽고, 은은한 향까지 느낄 수 있어 누구나 부담 없이 마시고 느낄 수 있는 막걸리다.","파전, 김치전 등 한식과 두루 잘 어울린다."
탁주(고도),톡쏘는 알밤동동,6%,"쌀, 정제수, 입국, 밤 농축액, 밤 추출물 등",톡 쏘는 알밤동동은 기성세대만 마신다는 막걸리의 이미지를 버리고 신세대를 겨냥한 새로운 막걸리로 우리 햅쌀에 국산 밤을 달달 하게 녹여 톡 쏘는 탄산까지 조합해 최적의 레시피로 완성한 상품이다. 20~30대 새로운 스타일의 막걸리로 캔의 디자인부터 아이디어가 톡톡 넘치는 알밤동동은 달달 한 맛이 밤맛 아이스크림을 먹는 듯한 착각을 불러 일으켜 누구나 쉽게 마실 수 있는 막걸리다.,기본 원료가 되는 쌀의 부드러움을 갖고 있으며 단맛이 강하고 산미가 적다. 밤농축액과 밤시럽이 들어가 어렸을 때 먹은 밤맛 아이스크림이 생각난다. 특별한 안주 없이 술만 마셔도 맛있게 먹을 수 있는 술이다.
탁주(고도),가평 잣 생막걸리,6%,"쌀, 정제수, 쌀입국, 잣, 효모, 정제효소 등","가평의 잣을 막걸리에 그대로 담아 특유의 고소한 맛으로 목 넘김이 부드럽고, 은은한 향까지 느낄 수 있어 누구나 부담 없이 마시고 느낄 수 있는 막걸리다. 일반 막걸리는 완전 발효가 되지 않는 미숙주가 많아 상품 상태에서도 발효가 활발하기 때문에 병을 흔들면 가스로 병이 터지거나, 넘치는 현상이 일어난다. 하지만 가평 생 막걸리는 저온 장기숙성방식으로 완전 발효를 실현하여 완숙주로 출시되어 흔들어도 터지거나 넘치지 않는다. 단맛, 신맛, 바디감, 목넘김 등 맛이 튀지 않고 적당하다. 쌀 막걸리의 가벼운 바디감과 부드러운 목넘김이 좋은 막걸리다.",반찬으로 나오는 우리음식과 모두 잘 어울린다.
탁주(고도),세종청주생막걸리,6%,"쌀, 소맥분",국내산 쌀과 함께 소맥분을 사용하여 소맥분 특유의 목 넘김과 함께 진한 맛을 느낄수 있는 청주의 대표 막걸리. 직접 배양한 효모와 100% 국내쌀과 고두밥을 청주의 맑은 물과 함께 저온 발효 시켜 숙성하여 빚은 술이다.,김치전은 잘 익은 김치의 맛이 배어나와 막걸리와 잘 어울리는 음식이다. 생막걸리 특유의 향이 김치의 텁텁한 맛을 감해주어 더욱 좋다.
탁주(고도),세종 알밤주,6%,"정제수, 백미, 소맥분, 알밤(국내산), 전분당, 효모, 젖산",알밤주는 세종의 노하우에 밤을 녹여 향기가 그윽하면서도 막걸리 특유의 새콤함까지 느낄 수 있는 아주 특색 있는 막걸리가 되었다. 막걸리에 거부감이 있는 사람도 거부감 없이 마실 수 있을 만큼 친근하게 마실 수 있는 것이 특징이다.,"진하게 올라오는 곡물 볶은 향과 밤 향, 단맛이 강하고 산미가 적으며 입 안을 묵직하게 채우지만 목넘김은 깔끔하다. 야채 샐러드와 잘 어울린다."
탁주(고도),지리산 정담 생쌀 막걸리,6%,"쌀(국내산), 종국, 정제수, 누룩, 효모",&quot;지리산 정담 생쌀 막걸리&quot;는 40년 가까이 청정지역 지리산에서 술을 빚어온 &quot;운봉주조&quot;의 대표 막걸리이다. 지리산의 맑은물과 국내산쌀만을 사용하여 제조하는 막걸리로 한층 부드럽고 순한 맛으로 인기가 좋다. 농림축산식품부에서 &quot;우리술 품질인증&quot;을 받고 2013년 전라북도 우리술품평회에서 수상한 제품이다.,색의 희고 맑으며 곡물에 압력을 가했을 때 나오는 고소한 향이 올라온다. 단맛이 적고 맑은 산미가 입안 전체에 침이 고이게 하고 산뜻하게 만든다. 막걸리를 마시고 난 뒤에 혀에 남는 고소함이 매력적이다. 신선한 과일 샐러드와 잘 어울린다.
탁주(고도),편백숲 산소막걸리 스파클링,6.8%,"찹쌀, 맵쌀, 누룩","편백숲 산소막걸리 스파클링은 멥쌀, 찹쌀, 누룩, 물로만 빚어 막걸리 본연의 맛을 찾은 무첨가 프리미엄 막걸리다. 샴페인과 같은 강렬한 탄산감이 찹쌀에서 나오는 순수한 단맛과 어울러져 청량감을 느낄 수 있다.","묵은 김치를 곁들인 홍어삼합이나 겉절이 김치를 곁들인 보쌈, 부침이나 전류와도 잘 어울린다."
탁주(고도),편백숲 산소막걸리 딸기 스파클링,6.8%,"찹쌀, 멥쌀, 누룩, 딸기, 올리고당","전남 장성군에서 재배한 쌀과, 장성군 특산물 딸기를 사용하여 빚은 막걸리. 딸기를 저온에서 쌀과 함께 발효시켜 딸기의 향기와 함께 새콤 달콤한 싱그러운 맛이 상큼하다.","묵은 김치를 곁들인 홍어삼합이나 겉절이 김치를 곁들인 보쌈, 부침이나 전류와도 잘 어울린다."
