탁주(고도),꿀막걸리,8%,"쌀(국내산), 벌꿀(국내산), 사과농축액, 효모, 정제효소","청산녹수만의 전통 누룩을 사용하여 전통적인 막걸리 맛을 지키면서 트랜디한 단맛을 자랑하는 제품이다. 청산녹수 꿀막걸리는 청산녹수 생탁에 천연 벌꿀을 가미하여 젊은 여성 소비자가 막걸리에 대한 거부감 없이 쉽게 접할 수 있도록 만든 제품이다. 전남 장성군의 자랑인 편백나무숲 맑은 공기와 청정한 물, 국내산 쌀과 전통누룩으로 빚어 저온에서 숙성한 제품이다. 독특하게 곡물의 고소함과 유자 향이 섞여 올라온다. 술을 입에 넣으면 단맛은 매우 적고 산미와 쓴맛의 조화가 매우 잘 갖춰져 있다.",목넘김은 매우 부드럽지만 쓴맛이 입 안의 느낌을 묵직하게 만들어 양념 갈비와 잘 어울린다.
탁주(고도),백련 생막걸리 snow (스노우),6%,"백미, 연잎, 정제수, 종국, 효모, 아스파탐, 물엿 등",간척지 토양에 서해안 해풍을 맞고 자란 충남 당진 쌀을 주원료로 깔끔한 맛을 내기 위해 백련잎을 첨가해 80년 전통의 발효전통으로 빚어낸 고품격 막걸리다. 부담없이 가볍게 즐길 수 있는 백련막걸리 보급형 제품으로 하얀 눈처럼 순백의 이미지와 시원하고 깔끔한 맛이 특징이 있다. 색은 희고 맑으며 은은하게 올라오는 달콤한 향기와 신선한 식물향이 난다. 전체적으로 오미의 균형을 잘 갖추고 있으며 목넘김이 매우 깔끔하다.,숯불바베큐와 잘 어울린다.
탁주(고도),우곡주,13%,쌀,"우곡주는 조선시대까지 양반과 부자층이 마셨던 주정 13도의 전통 탁주로 구연산이 주성분인 일반 탁주와 달리 젖산 외에 다양한 유기산을 풍부하게 함유하고 있어 별도의 조미료가 필요없는 자연의 맛 그대로 즐길 수 있는 술이다.  우곡주는 오랜 연구를 통해 발효미생물의 발효균형기술로 탄생한 제품으로, 국내산 유기농 백미를 사용한 첨가물이 없는 자연 그대로의 제품이다.",구절판과 어울린다.
탁주(고도),매화마름 호랑이 막걸리,7%,쌀,매화마름 호랑이 막걸리는 선조부터 물려받은 누룩과 양조기술로 빚은 발효과학이 많이 집약 되어 있는 프리미엄 막걸리다. 사용 된 누룩은 독자적으로 개발한 액상 누룩이며 제조방법 특허 보유 중인 배혜정도가 기술력의 상징이다. 호랑이 막걸리는 멸종위기식물 매화마름을 보존하는 한국내셔널트러스트의 매화마름쌀로 빚었다. 이 쌀은 논으로는 세계 최초로 람사르습지로 등록 된 강화 매화마름 군락지에 서식하는 논에서 수확한 유기농 쌀이다.,파전과 잘 어울린다.
탁주(고도),부자 송산포도,9%,"쌀, 누룩, 포도즙","고려시대부터 기록으로만 전해오던 쌀과 포도로 빚은 전통탁주를 배혜정도가의 노하우로 빚어낸 신개념 쌀포도 탁주다. 조선시대때 기록된 양주방에 나오는 포도주는 포도즙을 짜내어 찐 찹쌀과 소맥곡의 가루를 섞은 것이며, 중국의 북산주경에 나오는 포도주라 할 수 있는 것도 쌀밥과 소맥곡의 가루에 포도즙을 넣은 것이다. 고려시대 때 포도주라고 기록되어 있는 것은 배혜정도가의 부자 송산포도막걸리와 유사한 아시아식 포도주, 즉 쌀, 누룩, 포도즙으로 빚은 포도주라고 할 수 있다.",고기산적과 잘 어울린다.
탁주(고도),부자,"10%  
							 
								 13%  
							 
								 16%","쌀, 정제수, 고과당, 효모 등","쌀과 누룩으로만 빚어 자연이 숙성시키는 있는 그대로의 맛을 느낄 수 있으며 100% 경기미를 사용하여 음용감이 부드럽고 은은한 유백색의 기풍이 느껴지는 막걸리다. 부자 막걸리는 탁주와는 만드는 법이 약간 다른, 합주에 속하는 고급술이다.","텁텁함이 없고 뒷맛이 깨끗해 다양한 안주와 잘 어울린다. 전 혹은, 삼겹살과 즐기기 좋다."
탁주(고도),느린마을 막걸리,6%,"쌀, 국, 효모, 정제수","느린 마을 막걸리는 계절마다 맛이 약간씩 다르다. 쌀과 물, 누룩만을 이용해서 빚는 술이기 때문에 계절에 따라 온도와 습도 등 계절마다 다른 숙성 환경이 그 이유인데, 일체 다른 인공감미료를 넣지 않아 만들어 원재료 그대로의 맛을 느낄 수 있는 막걸리다. 여름에 잘 익은 과일향이 올라오고 독특한 단맛을 가지고 있는 것이 특징이며, 입 안에 연하게 남는 쓴맛이 음식과의 조화를 잘 이룬다.","막걸이와 전 조합도 좋지만 크리미함과 달콤함이 느껴져 매콤, 새콤한 음식과 궁합이 좋다."
탁주(고도),붉은 원숭이,10.8%,"쌀(국내산 경기미 100%), 누룩, 홍국, 정제수","붉은 원숭이는 술샘에서 장미를 그대로 말려놓은 것 같은 매력적인 홍국쌀로 만든 탁주다. 곡물의 부드러움을 잘 갖추고 있으며, 일반 막걸리와 달리 달지 않고 입안에 남는 끝맛이 깔끔한 것이 특징이다. 홍국쌀은 경기미를 자연발효 시켜 만드는 쌀로, 술샘은 이를 이용해 100% 수작업으로 붉은 원숭이를 빚는다.",바베큐와 잘 어울린다.
탁주(고도),왕피천을 품은 미소생막걸리,7%,"쌀, 누룩, 정제수",울진 왕피천에서 올라오는 맑은 물 맛과 쌀 막걸리 특유의 부드러움과 하늘하늘한 가벼움이 느껴지는 막걸리다. 경상북도 울진군에서 생산되는 막걸리이며 할아버지에서 손자에 이르기까지 3대에 걸쳐 약 90여년이라는 시간을 통해 그 내력을 이어오고 있는 제품이다. 다른 막걸리 제품과는 달리 막걸리 본연의 맛을 유지하기 위해 알코올 도수 7%를 유지하고 있으며 천연탄산의 청량감과 새콤달콤한 맛의 특징을 가지고 있다.,대게 또는 홍게찜과 잘 어울린다.
탁주(고도),미소 생막걸리,7%,"쌀(국내산), 누룩, 정제수",경상북도 울진군에서 생산되는 막걸리이며 할아버지에서 손자에 이르기까지 3대에 걸쳐 약 90여년이라는 시간을 통해 그 내력을 이어오고 있는 제품이다. 자연환경생태보존지역인 울진의 깨끗한 자연환경에서 선물 받은 맑고 깨끗한 지하 암반수와 엄선된 원료 그리고 현대적인 위생시설에서 정성을 더하여 만들고 있다. 다른 막걸리 제품과는 달리 막걸리 본연의 맛을 유지하기 위해 알코올 도수 7%를 유지하고 있으며 천연탄산의 청량감과 새콤달콤한 맛의 특징을 가지고 있다.,대게 또는 홍게찜과 잘 어울린다.
탁주(고도),배꽃 필 무렵,9%,"정제수, 멥쌀(국내산), 누룩","‘배꽃 필 무렵’은 이화주다. 이화주는 ‘배꽃 필 때 빚는다’ 하여 이화주(梨花酒)라고 불린다. 이화주는 고려시대 때부터 빚어졌던 술로, 빛깔이 희고 된죽과 같아 숟가락으로 떠먹기도 하고, 찬물에 타서 마시기도 한다.",식감을 살려줄 수 있는 강정류나 잣향을 풍부하게 느끼기 위해 잣박산을 곁들여도 좋다.
탁주(고도),홍천강 탁주,11%,"홍천 쌀, 정제수, 국(밀 누룩)",홍천강 탁주는 강원도 골짜기에서 골골히 모여 내려오는 계곡물로 이루어진 홍천강의 청정한 이미지를 형상화 했다. 홍천의 쌀과 누룩으로 숙성시킨 전통주로 찹쌀과 멥쌀을 3:1 비율로 섞어 빚은 이양주(두 번 빚은 술)로 멥쌀 술 특유의 드라이함과 담백함을 가지고 있다. 홍천강 탁주는 아스파탐 등의 감미료가 들어가지 않는 생 탁주로 전통누룩을 사용하고 홍천의 쌀과 멥쌀을 이용하여 두 번을 빚는 이양주다. 기교를 부리지 않고 있는 그대로 만들어 내는 홍천 예술의 전통을 그대로 느낄 수 있는 전통주로 옛 막걸리의 맛을 느끼기에 알맞는다.,"연하게 올라오는 바닐라 향기가 술이 오래 숙성되었음을 말해주고, 청량미는 적으나 입안에 맴도는 깨끗한 산미가 음식을 부른다. 양념갈비와 잘 어울린다."
탁주(고도),우리밀 막걸리 향수,9%,"쌀, 밀, 입국, 누룩, 정제수",향수 우리밀 막걸리는 충북 옥천을 대표하는 막걸리로 알코올 도수 9도로 충북에서 자란 금강밀로 생산하고 있다. 1930년대 증조부 때부터 옥천에서 술을 빚고 있는 이원양조장은 80여 년에 걸쳐 4대째 술을 빚고 있다. 우리밀의 진한 맛과 향을 느껴보실 수 있다.,"도리뱅뱅이. 도토리묵, 겉절이, 나물과 잘 어울린다."
탁주(고도),호랑이배꼽,6.5%,"평택 쌀(현미 40%, 백미 60%), 누룩, 정제수, 정백당",인공 첨가물과 감미료 없이 평택의 최상급 쌀과 새싹현미로만 빚은 생막걸리다. 전통 가양주 방식 그대로 100일간의 발효와 숙성을 거쳐 제조한다. 저온 숙성으로 막걸리 특유의 달고 구수한 곡향이 풍성하게 느껴지고 유산균이 다량 살아 있는 건강한 술이다.,호두바게트와 잘 어울린다.
탁주(고도),술취한 원숭이,10.8%,"쌀(국내산 경기미 100%), 누룩, 홍국, 정제수","붉은 쌀 홍국을 넣어 만들어 말린 장미처럼 고혹적인 붉은빛을 띠는 막걸리다. 인공색소나 합성감미료 없이 쌀과 홍국, 누룩, 물로만 빚어 만든다. 막걸리 특유의 부드러운 곡향이 진하지만 달지 않고 드라이해 어떤 음식과도 잘 어울린다. 살균탁주 버전 ‘붉은 원숭이’도 있다.","과일, 치즈와 잘 어울린다."
탁주(고도),부안참뽕막걸리,6%,"쌀(국내산) 오디과즙,스테비올배당체,스쿠랄로스",막걸리와 오디를 넣은 과실막걸리다. 탄산이 첨가되어 청량감을 주며 텁텁함이 없이 깔끔한 것이 특징으로 오디가 첨가되어 색깔이 보랏빛을 띄고 있다. 살균 처리가 되어 있어 상온에서도 보관이 가능하며 보존기간이 길며 깔끔하고 깨끗한 뒷맛은 물론 오디의 빛깔까지 갖추고 있어 눈과 입을 동시에 만족시켜 주는 막걸리다.,"매운 볶음요리, 부침개와 잘 어울린다."
탁주(고도),금정산성막걸리,8%,"백미, 밀(누룩), 정제수",금정산성막걸리는 술빚기에 적합한 온도와 습도가 유지되는 해발 400m의 청정 환경을 갖춘 금정산성마을에서 제조된다. 깨끗한 자연환경속에서 발효된 자연산 누룩과 250m의 암반수를 사용하여 금정산성 전통 막걸리의 맛을 그대로 느낄 수 있는 알코도수 8도의 100% 국내산 살아있는 쌀막걸리로 누룩 질이 전국 으뜸이며 산수로 술을 빚기 때문에 은은한 향과 구수한 맛이 일품이다.,"파전, 두부김치와 잘 어울린다."
탁주(고도),1932 새싹땅콩+햅쌀/흑미,6%,"새싹땅콩+고시히카리 쌀, 새싹땅콩+진도산 흑미","당해연도 고시히카리쌀과 진도산 흑미를 주 원료로 사용했다. 새싹땅콩의 항산화 물질인 ‘레즈베라트롤’이다량 함유 되었있고, 전통누룩에서 뽑아낸 우수한 균주를 사용했다. 합성감미료는 사용하지 않았으며, 미생물 발효 조절방식으로 냉장보관 시 신선한 맛과 주질을 유지할 수 있다.",마늘새우와 잘 어울린다.
탁주(고도),2017년 햅쌀로 빚은 첫술,7%,국내산 햅쌀,"2017년 햅쌀로 빚은 첫술은 매년 가을철, 그 해 수확한 햅쌀로 빚은 프리미엄 생 막걸리로 계절 한정 상품으로 선보인다. 올해 수확한 경북 안동 햅쌀을 원료로 빚어, 생 막걸리 특유의 탄산감이 살아있으면서도 부드럽고 신선한 쌀의 향과 맛을 느낄 수 있다.",
탁주(고도),사미인주,8%,"유기농 햅쌀, 벌꿀","전라남도 노령산맥 암반수와 100% 친환경 유기농 햅쌀, 천연 벌꿀을 발효시켜 만든다. 어떠한 첨가물도 들어가지 않은 프리미엄 생막걸리다. 아름다운 아낙들이 생쌀을 씹어 뱉어 담갔다 해서 미인주라 이름 붙은 전통주에 송강 정철의 사미인곡(思美人曲)의 의미를 담았다. 님과 함께 마시는 아름다운 술이란 뜻으로도 풀이된다.",리코타 치즈 샐러드와 잘 어울린다.
탁주(고도),문희 탁주,13%,국내산 쌀,"프리미엄 탁주인 문희는 문경주조가 위치한 문경의 옛 이름인 문희에서 따온 술로 기쁜 소식을 전한다는 의미를 담고 있다. 모든 술 빚는 과정 하나하나를 손으로 직접 하고 있는 수제 전통주로, 힘겨운 육체노동 뒤 황토 벽돌로 지은 황토 방에서 100일 이상 자연 건조로 숙성 시키는 기다림 끝에서야 비로소 진짜배기 탁주를 얻을 수 있다.인공 감미료를 전혀 쓰지 않고 유기농 햇 찹쌀과 전통 누룩 그리고 천연 암반수로만 빚어 숙취가 없고 풍미가 상당히 뛰어난 탁주다.","수육, 순대 볶음, 닭갈비와 잘 어울린다."
탁주(고도),우렁이쌀 손 막걸리,7.5%,"쌀, 정제수 효모, 정제효소, 효소처리 스테비아","양촌 우렁이쌀 손 막걸리는 우렁이 농법으로 100% 무농약 재배한 논산 햅쌀로 빚은 수제 막걸리다. 기존 생 막걸리 3배 이상 긴 시간 동안의 저온숙성 단계를 지나서야 비로소 소비자와 교감할 수 있는 깨끗함과 깊은 맛을 낸다. 부드러운 목 넘김이 특징인 7.5도의 우렁이 쌀 막걸리는 양촌양조 프리미엄 탁주의 대표주자이다. 또한, 볶은듯한 곡물의 향, 바나나 향이 느껴진다. 단맛이 부드럽고 점잖게 올라오는 반면에 신맛은 가볍게 따라온다. 가벼운 바디감과 청량감이 편안한 자리의 시작으로 좋을 듯하다.","새콤달콤한 골뱅이 무침, 혹은 쑥버무리와 함께 즐기면 좋다."
탁주(고도),안양동동주,6%,"국내산 햅쌀, 국내산 친환경 햇찹쌀","국내산 친환경 햇 찹쌀과 햅쌀에 당화력이 좋은 밀 누룩과 보리누룩을 발효제로 사용해 빚은 막걸리로 다양한 재료들이 술의 향과 맛의 조화를 이룬다. 찹쌀은 미감을 부드럽게, 쌀은 전체적인맛과 향의 조화, 보리누룩은 은은한 단맛을, 밀의 당화력은 청량한 목 넘김을 주면서, 전체적으로 부드러우면서도 전통적인 투박한 맛이 강점이다.","키조개 회 무침 안양은 키조개, 한우, 표고버섯이 유명한곳이다. 키조개는 단백질이 많은 저칼로리식품으로 필수아미노산과 철분이 많아 동맥경화와 빈혈예방에 좋고, 새콤하고 칼칼한 회 무침에 청량감이 좋은 안양동동주 한잔이 생각난다."
탁주(고도),줄포 생막걸리,6%,국내산 쌀,"1980년대 부안군 줄포면 동진주조장에서 첫 출시하여 2014년 현재까지 꾸준하게 주질 향상을 위해 품질개선과 공정관리, 위생관리 등에 노력하여 막걸리의 세계화와 전통주의 고급화에 노력하고 있다. 줄포 생 막걸리는 백미를 사용하여 전통발효기술에 최첨단온도 제어시스템으로 저온발효, 저온숙성방식으로 영양이 풍부하며 자연발효에 의한 자연탄산과 어우러져 감칠맛과 청량감이 풍부하여 젊은이들에게도 꾸준한 사랑을 받고 있다.","주꾸미볶음, 홍어무침 칼칼한 주꾸미볶음에 줄포 생 막걸리를 곁들이면 청량감과 어울려지는 깔끔한 맛을 느낄 수 있으며 홍어무침과 곁들이면 홍어 특유의 맛을 더욱더 살려줄 수 있다."
탁주(고도),천마이야기 막걸리,6%,"팽화미, 입국미, 무주천마분말, 오미자추출액","한방에서는 혈액순환, 두뇌활동개선, 두통에 천마를 처방한다. 100% 무주산 천마와 쌀을 발효하여 만든 프리미엄 막걸리이다. 전통막걸리에 프랑스샴페인 지방의 후발효방식을 접목하여 자연발생탄산의 함량이 높아 청량감이 오래 지속되며, 원료가공의 차별화로 목 넘김이 부드럽고 깔끔한 것이 특징이다.","도토리묵, 골뱅이무침 소화기능을 촉진시켜 입맛을 돋우어주는 도토리와 타우린이 풍부하여 노화방지에도 탁월한 골뱅이를 새콤달콤하게 무쳐서 천마이야기 막걸리와 함께하면 상쾌한 탄산의 맛과 어울려 음식을 맛을 더욱 돋구어 준다."
탁주(고도),부안참뽕막걸리(탄산),6%,국내산 쌀,국내산 쌀로 빚은 막걸리에 오디과실원액과 천연탄산을 첨가하여 특유의 청량감과 달콤함을 느낄 수 있고 뒷맛이 깔끔하고 깨끗한 막걸리이다.,"야채꼬치, 과일 소시지, 대파, 파프리카, 토마토 등의 재료를 꼬치에 꿰어 팬에 구워내는 음식으로 참뽕 막걸리의 달콤한 청량감이 고소한 꼬치구이와 잘 어울린다. 참뽕 막걸리가 순하고 깔끔해 과일을 곁들여도 맛있게 즐길 수 있다. 포도, 딸기, 바나나, 단감 등의 여러 가지 과일을 기호에 맞게 선택하면 좋다."
탁주(고도),자연담은 복분자막걸리,6%,"국내산 복분자(고창), 정제수","고창산 쌀과 고창산 1등급 복분자로 빚은 고급막걸리로 국순당의 특허기술인 생쌀발효법으로 빚어 필수아미노산이 풍부하다. 복분자와 쌀이 혼합된 막걸리로 신선한 과실향에 부드럽게 올라오는 곡물향이 잘 섞여 있다. 단맛과 신맛 등 오미의 조화가 잘 갖춰져 있고, 막걸리를 살균하여 청량미는 적지만 맑은 산미가 입 전체를 깔끔하게 만든다.",복분자 막걸리에 장어구이가 기본이다.
탁주(고도),팔공산미나리 생막걸리,6%,"쌀, 소맥분, 전분당, 정제수, 무농약 미나리추출액, 정제효소, 종국, 효모, 아스파탐, 밀 함유",미나리 생막걸리는 혈압을 내리고 중금속해독능력이 뛰어난 친환경 미나리를 사용하여 빚은 막걸리로 대구 팔공산 일대의 농가에서 생산하여 5년간 숙성한 미나리발효원액을 첨가해 쌀과 막걸리의 산성화를 중화하여 막걸리의 트림현상과 숙취가 거의 없는 것이 특징이다.,"생 미나리 두부무침, 미나리 전미나리는 비타민이 풍부한 알칼리성 식품으로 혈압강하, 해열, 일사병 및 변비 등에 효과가 좋다. 미나리를 활용한 안주와 막걸 리가 함께하면 건강과 맛을 동시에 챙길 수 있을 것이다."
탁주(고도),백년친구 쌀막걸리,6%,"백미, 소맥분",술맛이 부드럽고 뒷 향이 은은하게 느껴지는 것이 마시는 이로 하여금 부담을 주지 않으며 또한 뒷맛이 깔끔하고 목 넘김이 좋은 막걸리이다.,가지나물 가지를 식물성 기름으로 요리를 하면 불포화지방산과 비타민E를 많이 섭취할 수 있어서 좋은데 막걸리의 부드러운 목 넘김과 은은한 향을 가지나물이 잘 지켜준다.
탁주(고도),불로생우리쌀막걸리,6%,국내산 쌀,불로생 우리쌀 막걸리는 50년 전통의 생 막걸리로 효모가 살아있어 특유의 감칠맛을 느낄 수 있을 뿐만아니라 효모에 함유된 판토텐산이 대장의 운동을 활발하게 하여 변비에도 좋으며 몸에 좋은 각종영양소가 풍부하다.,"두부김치, 해물전 두부김치는 따뜻하게 데친 두부에 익은 김치와 돼지고기를 볶아 곁들인 음식으로 아삭한 김치의 맛이 조화를 이루어 막걸리안주로 좋다. 또한, 해산물과 야채로 만든 해물전과도 궁합이 좋다."
탁주(고도),하얀연꽃 백련생막걸리,7%,"국내산 백미, 국내산 백련잎",신평양조장은 막걸리를 옛날의 술로 머물게 하지 않고 오늘날 우리 삶 속에서 같이 호흡할 수 있도록 막걸리의 모던 프리미엄주의를 지향한다. 간척지 토양에서 해안해풍을 맞고 자란 충남당진 쌀을 주 원료로 하며 깔끔한 맛을 내기위해 백련잎을 첨가했다. 80년이상 된 숨 쉬는 재래식항아리에서 철저한 온도관리에 의해 발효하여 소량 한정 생산되는 수제프리미엄막걸리로 깊은 맛과 은은한 탄산의 조화가 일품이며 안개와 같이 은은하면서도 신비로운 맛이 특징이다.,"스테이크 프리미엄 막걸리인 하얀연꽃 백련 생 막걸리는 스테이크와도 거부감 없이 잘 어울리며 감자, 당근, 콩, 옥수수, 시금치 같은 채소요리를 곁들이고 소스 없이 같이 마시면 백련 생 막걸리의 담백한 맛이 은은하게 입안을 채운다."
탁주(고도),울금생막걸리 정,6%,"국내산 쌀, 국내산 울금",쌀을 주재료로 한 막걸리에 울금을 첨가하여 특허를 받은 막걸리이다. 입안에서 감도는 울금 특유의 향과 마시고난 후 오랫동안 여운을 주는 감미로운 맛이 일품이다.,"김치전 김치전은 잘 익은 김치의 맛이 배어나와 막걸리와 잘 어울리는 음식인데, 울금 생막걸리 특유의 향이 김치의 텁텁한 맛을 감해주어 더욱 좋다."
탁주(고도),세종 쌀막걸리,6%,국내산 쌀,"세종 쌀 막걸리는 부드러운 맛을 음미할 수 있고 달달하며 청량감이 살아있다. 특히 밀을 넣어 감칠맛을 돋우어준 충북청주의 유명막걸리로 부드러운 목 넘김이 특징이다. 조은술세종(주)은 현재 20여종의 전통주를 생산하고 있으며, 2012년 유기막걸리를 생산하기 시작하여 유기가 공식품인증을 획득했으며 전통주 시장에서 선도적인 역할을 담당하고 있다.","해물 찜 해물 찜은 각종해물과 콩나물을 매콤한 양념에 버무려 푸짐하게 만들면 여럿이 둘러앉아 먹기 좋은 막걸리 안주가 된다. 콩나물은 아스파라긴이 함유되어 숙취해소와 피로회복에 좋은데, 살짝 익혀 아삭한 맛이 막걸리의 맛을 돋운다."
탁주(고도),구암대추막걸리,6%,"쌀, 대추","청송의 맑은 물과 수목이 가득한 자연 속에서 직접 재배한 양질의 대추로 만든 대추엑기스, 국내산 100% 쌀로 정성껏 빚어 목 넘김이 부드러운 막걸리이다. 구암농산은 1981년 대추농장으로 2만주 대추나무를 식재하여 현재 약7만평규모, 20만평 야산을 보유하고 있는 경북최대 대추농장으로 성장하여 2008년 구암농산을 설립하였고, 2년여 연구개발 끝에 2010년부터 맛과 기술에서 인정받는 대추 막걸리를 생산해 오고 있다.",가벼운 안주와 어울린다.
탁주(고도),솔청정막걸리,6%,국내산 쌀,"솔잎은 위장병, 고혈압, 중풍 등 민간요법에서 만병통치약으로 여겨져 왔으며, 과거 양주문헌에서 전해지는 전통제조방법을 참고하고 최신 발효법에 의한 첨가비율 및 제조방법을 심도 있게 연구·개발하여 제품화하였다. 약수로 유명한 충청북도의 지하100m 천연 암반수에 생 솔잎을 첨가 발효시켜 빚은 후 살균열처리를 통해 유통기한을 늘린 살균막걸리이다. 은은한 솔 향과 적정량의 천연탄산이 있어 청량감과 목 넘김이 부드럽고 감칠맛이 특징이다.","두부 전 당근, 양파, 대파, 피망 등의 다진 야채와 으깬 두부를 소금, 후추, 다진 마늘로 간을 하고, 계란을 풀어 섞은 후 달군 팬에서 구워내면 된다. 채소를 듬뿍 넣은 영양만점의 두부전이 솔 향 은은한 막걸리로 더욱 고소해진다."
탁주(고도),백년친구 풍기홍삼막걸리,6%,"국내산 쌀, 홍삼",경북 영주시(풍기)는 토질이 대부분 사질양토로 배수가 잘되어 타지방 인삼보다 육질이 단단하고 사포닌 함량이 우수한데 백년친구 풍기홍삼 막걸리는 이 지역에서 생산한 인삼을 가공한 홍삼을 사용하여 막걸리와 접목시켰다. 홍삼을 72시간동안 엑기스로 추출하여 사포닌함량이 우수하고 홍삼의 부드러운 붉은색을 띄며 쌀 막걸리의 부드러운 맛과 홍삼의 쌉싸름한 맛을 동시에 느낄 수 있다.,"호박전 호박은 소화가 잘되므로 위가 약하고 마른 사람, 회복기 환자에게 좋은 음식인데, 사포닌이 함유된 홍삼막걸리와 궁합이 잘 맞는다. 애호박에 달걀옷을 입혀 양면을 노릇노릇하게 지져서 한잔 곁들이면 잘 어울린다."
탁주(고도),하얀연꽃 백련막걸리,7%,국내산 쌀,신평양조장은 막걸리를 옛날의 술로 머물게 하지 않고 오늘날 우리삶속에서 같이 호흡할 수 있도록 막걸리의 모던프리미엄주의를 지향한다. 하얀연꽃 백련막걸리는 전통적으로 사찰에서 전수되어온 백련곡차의 현대적 복원으로 당진 해나루쌀을 사용하여 술의 빛깔이 밝고 부드러우며 백련잎을 발효과정에 첨가하여 맛이 은은하고 부드러운 것이 특징이다.,"스테이크 스테이크는 감자, 당근, 콩, 옥수수, 시금치 같은 채소요리를 곁들이고 소스 없이 막걸리와 함께 먹으면 담백한 막걸리의 맛이 은은하게 입안을 채운다."
